Código da Loja;Código do Fornecedor;Nome do Fornecedor;Número do Documento;Situação;Data De Emissão;Data de entrada;Frete;Outros;Seguro;Desconto;IPI;DAE;ICMS Desonerado;FECOP;Valor FECOPST;FECOP Retido;Base de Cálculo ICMS;Valor BC do ICMS;Base de Cálculo ICMSST;Valor BC ICMSST;Valor Total
1;169;GLOBIMPORT COMERCIO E IMPORTACAO LTDA;83635;EFETIVADA;24/11/2023;02/12/2023;0,00;0,00;0,00;0,00;92,72;0,00;0,00;0,00;0,00;0,00;1244,36;49,78;0,00;0,00;1337,08
1;572;SUPER VINHOS DISTRIBUIDORA S.A.;187290;EFETIVADA;07/12/2023;08/12/2023;0,00;0,00;0,00;0,00;0,00;0,00;358,27;7,81;2,32;0,00;391,11;114,19;346,41;42,90;780,68
1;521;OTIMA COMERCIO ATACADISTA DE PROD.E IMP.EIRELI;9111;EFETIVADA;07/12/2023;08/12/2023;0,00;0,00;0,00;0,00;0,00;0,00;0,00;27,92;0,00;0,00;1395,48;251,17;0,00;0,00;464,16
1;475;RV COMERCIO ATACADISTA DE ALIMENTOS E BEBIDAS LTDA;6136;EFETIVADA;07/12/2023;09/12/2023;0,00;0,00;0,00;0,00;0,00;0,00;0,00;0,00;0,00;0,00;0,00;0,00;0,00;0,00;2062,32
1;573;NOVA COQUEIRO DE ALIMENTOS LTDA;1351706;EFETIVADA;08/12/2023;08/12/2023;0,00;0,00;0,00;0,00;0,00;0,00;40,51;2,85;0,00;0,00;142,56;52,75;0,00;0,00;1197,60
1;395;NOSSA SENHORA COMERCIO E DISTRIBUIDOR LT;895599;EFETIVADA;12/12/2023;14/12/2023;0,00;1,90;0,00;0,00;0,00;0,00;1998,63;27,80;11,36;0,00;1389,41;514,09;1957,89;210,33;4739,07
1;68;RIO DE JANEIRO REFRESCOS;966095;EFETIVADA;19/12/2023;20/12/2023;0,00;45,07;0,00;62,94;120,45;0,00;0,00;126,97;52,81;0,00;6348,56;1028,20;8988,96;428,87;119,51
1;395;NOSSA SENHORA COMERCIO E DISTRIBUIDOR LT;900940;EFETIVADA;27/12/2023;29/12/2023;0,00;1,90;0,00;0,00;0,00;0,00;825,93;11,48;4,56;0,00;574,17;212,45;802,18;84,36;1956,84
